{
  "project_id": "generic-fixture",
  "project_name": "Generic Fixture",
  "domain": "software",
  "source_roots": [
    "src"
  ],
  "project_docs": [
    "doc/composition.md"
  ],
  "primary_doc": "doc/composition.md",
  "pipeline": {
    "main": "npm test"
  },
  "artifacts": {
    "metrics_dir": "src/output/metrics"
  },
  "optional_artifacts": [],
  "capabilities": {
    "pipeline_summary": false
  },
  "health": {}
}
